{"$schema":"https://json-schema.org/draft/2020-12/schema","$id":"suggested-question.schema.json","type":"object","additionalProperties":false,"required":["id","postId","topicId","text","type","targetConceptIds","generic"],"properties":{"id":{"type":"string","minLength":1,"maxLength":128},"postId":{"type":"string","minLength":1,"maxLength":128},"topicId":{"type":"string","minLength":1,"maxLength":128},"text":{"type":"string","minLength":1,"maxLength":240},"type":{"enum":["clarification","evidence","counterpoint","connection","implication","example","reliability"]},"targetConceptIds":{"type":"array","items":{"type":"string","minLength":1,"maxLength":128},"uniqueItems":true,"maxItems":100},"targetClaimIds":{"type":"array","items":{"type":"string","minLength":1,"maxLength":128},"uniqueItems":true,"maxItems":100},"generic":{"type":"boolean"}}}
