[
  {
    "id": "question-candidate-0000-01",
    "postId": "candidate-0000",
    "topicId": "ai-agents-future-work",
    "text": "How do AI agents, which do not necessarily align with economic incentives, differ from the fully rational actors modeled in traditional economic theory?",
    "type": "clarification",
    "targetConceptIds": [
      "concept-d33b22ce41f45ea7046e"
    ],
    "targetClaimIds": [
      "claim-candidate-0000-02"
    ],
    "generic": false
  },
  {
    "id": "question-candidate-0000-02",
    "postId": "candidate-0000",
    "topicId": "ai-agents-future-work",
    "text": "What evidence supports the claim that intrinsic reasoning capabilities are superior to external scaffolding in dynamic, long-horizon markets?",
    "type": "evidence",
    "targetConceptIds": [
      "concept-2059bc5318a907c9509d"
    ],
    "targetClaimIds": [
      "claim-candidate-0000-02"
    ],
    "generic": false
  },
  {
    "id": "question-candidate-0000-03",
    "postId": "candidate-0000",
    "topicId": "ai-agents-future-work",
    "text": "How does the co-evolution of agents and market mechanisms introduce new risks for market failure?",
    "type": "implication",
    "targetConceptIds": [
      "concept-d33b22ce41f45ea7046e"
    ],
    "targetClaimIds": [
      "claim-candidate-0000-01"
    ],
    "generic": false
  },
  {
    "id": "question-candidate-0000-04",
    "postId": "candidate-0000",
    "topicId": "ai-agents-future-work",
    "text": "In what ways do simulated environments allow for the study of 'agentic' cognitive biases compared to human biases?",
    "type": "connection",
    "targetConceptIds": [
      "concept-4e40bea07635c9f1e056"
    ],
    "targetClaimIds": [
      "claim-candidate-0000-02"
    ],
    "generic": false
  },
  {
    "id": "question-candidate-0000-05",
    "postId": "candidate-0000",
    "topicId": "ai-agents-future-work",
    "text": "What role does 'Theory of Mind' play in enabling agents to effectively manage reputation within a competitive labor market?",
    "type": "example",
    "targetConceptIds": [
      "concept-4e40bea07635c9f1e056"
    ],
    "targetClaimIds": [
      "claim-candidate-0000-01"
    ],
    "generic": false
  },
  {
    "id": "question-candidate-0001-01",
    "postId": "candidate-0001",
    "topicId": "ai-agents-future-work",
    "text": "How do the performance gains observed with HITL re-attempts vary across different professional domains in the benchmark?",
    "type": "implication",
    "targetConceptIds": [
      "concept-68e155f7aba2959df921"
    ],
    "targetClaimIds": [
      "claim-candidate-0001-02"
    ],
    "generic": false
  },
  {
    "id": "question-candidate-0001-02",
    "postId": "candidate-0001",
    "topicId": "ai-agents-future-work",
    "text": "What specific metrics beyond success rates are most useful for distinguishing the quality of AI-generated deliverables in professional contexts?",
    "type": "clarification",
    "targetConceptIds": [
      "concept-3d119f7942924710c399"
    ],
    "targetClaimIds": [
      "claim-candidate-0001-01"
    ],
    "generic": false
  },
  {
    "id": "question-candidate-0001-03",
    "postId": "candidate-0001",
    "topicId": "ai-agents-future-work",
    "text": "Could the reliance on freelance expert evaluators introduce bias that favors specific types of AI reasoning styles?",
    "type": "reliability",
    "targetConceptIds": [
      "concept-68e155f7aba2959df921"
    ],
    "targetClaimIds": [
      "claim-candidate-0001-02"
    ],
    "generic": false
  },
  {
    "id": "question-candidate-0001-04",
    "postId": "candidate-0001",
    "topicId": "ai-agents-future-work",
    "text": "How does the UpBench framework handle potential confidentiality and data privacy constraints inherent in real-world freelance marketplace jobs?",
    "type": "clarification",
    "targetConceptIds": [
      "concept-3d119f7942924710c399"
    ],
    "targetClaimIds": [
      "claim-candidate-0001-01"
    ],
    "generic": false
  },
  {
    "id": "question-candidate-0001-05",
    "postId": "candidate-0001",
    "topicId": "ai-agents-future-work",
    "text": "In what ways do real-world economic benchmarks compare to synthetic 'sandbox' environments in testing agent resilience?",
    "type": "connection",
    "targetConceptIds": [
      "concept-f0e5f53af7e637286fd5",
      "concept-3d119f7942924710c399"
    ],
    "targetClaimIds": [
      "claim-candidate-0001-01"
    ],
    "generic": false
  },
  {
    "id": "question-candidate-0002-01",
    "postId": "candidate-0002",
    "topicId": "ai-agents-future-work",
    "text": "How does the workflow coverage factor (COV) specifically distinguish agentic automation from previous task-based models?",
    "type": "clarification",
    "targetConceptIds": [
      "concept-d923e20d267caeebae5e",
      "concept-465dad65bdb4765b02d1"
    ],
    "targetClaimIds": [
      "claim-candidate-0002-01"
    ],
    "generic": false
  },
  {
    "id": "question-candidate-0002-02",
    "postId": "candidate-0002",
    "topicId": "ai-agents-future-work",
    "text": "What are the limitations of the keyword-based rubric used to calculate COV scores?",
    "type": "reliability",
    "targetConceptIds": [
      "concept-d923e20d267caeebae5e"
    ],
    "targetClaimIds": [
      "claim-candidate-0002-02"
    ],
    "generic": false
  },
  {
    "id": "question-candidate-0002-03",
    "postId": "candidate-0002",
    "topicId": "ai-agents-future-work",
    "text": "How do reinstatement roles, such as AI Governance, differ from traditional technical positions in their skill requirements?",
    "type": "connection",
    "targetConceptIds": [
      "concept-ce070d0660ad51b45b5b",
      "concept-f0e5f53af7e637286fd5"
    ],
    "targetClaimIds": [],
    "generic": false
  },
  {
    "id": "question-candidate-0002-04",
    "postId": "candidate-0002",
    "topicId": "ai-agents-future-work",
    "text": "Why are current ATE projections considered model-derived estimates rather than empirical measurements of observed displacement?",
    "type": "evidence",
    "targetConceptIds": [
      "concept-3acd44b3729532f42dcd"
    ],
    "targetClaimIds": [
      "claim-candidate-0002-02"
    ],
    "generic": false
  },
  {
    "id": "question-candidate-0002-05",
    "postId": "candidate-0002",
    "topicId": "ai-agents-future-work",
    "text": "What evidence supports the claim that agentic AI adoption is sensitive to regional innovation density?",
    "type": "evidence",
    "targetConceptIds": [
      "concept-3ab9805cb32fbdf257b3"
    ],
    "targetClaimIds": [],
    "generic": false
  },
  {
    "id": "question-candidate-0003-01",
    "postId": "candidate-0003",
    "topicId": "ai-agents-future-work",
    "text": "Why did the single-model RAG baseline outperform the multi-agent system in terms of answer correctness in this study?",
    "type": "evidence",
    "targetConceptIds": [
      "concept-1917e406080cd1b20da1",
      "concept-a1f9d63328074e333a90"
    ],
    "targetClaimIds": [
      "claim-candidate-0003-01"
    ],
    "generic": false
  },
  {
    "id": "question-candidate-0003-02",
    "postId": "candidate-0003",
    "topicId": "ai-agents-future-work",
    "text": "How do role-based task delegation mechanisms influence the output of LLM systems in legal domains?",
    "type": "connection",
    "targetConceptIds": [
      "concept-a1f9d63328074e333a90"
    ],
    "targetClaimIds": [
      "claim-candidate-0003-02"
    ],
    "generic": false
  },
  {
    "id": "question-candidate-0003-03",
    "postId": "candidate-0003",
    "topicId": "ai-agents-future-work",
    "text": "What specific limitations make BLEU an insufficient metric for evaluating legal text?",
    "type": "clarification",
    "targetConceptIds": [
      "concept-9fd749528fd321690c30"
    ],
    "targetClaimIds": [
      "claim-candidate-0003-03"
    ],
    "generic": false
  },
  {
    "id": "question-candidate-0003-04",
    "postId": "candidate-0003",
    "topicId": "ai-agents-future-work",
    "text": "Does the multi-agent architecture provide benefits for transparency or explainability that aren't captured by correctness scores?",
    "type": "implication",
    "targetConceptIds": [
      "concept-a1f9d63328074e333a90"
    ],
    "targetClaimIds": [
      "claim-candidate-0003-02"
    ],
    "generic": false
  },
  {
    "id": "question-candidate-0003-05",
    "postId": "candidate-0003",
    "topicId": "ai-agents-future-work",
    "text": "Are there specific design trade-offs when choosing between a single-model RAG pipeline and a multi-agent coordination framework?",
    "type": "counterpoint",
    "targetConceptIds": [
      "concept-1917e406080cd1b20da1",
      "concept-a1f9d63328074e333a90"
    ],
    "targetClaimIds": [
      "claim-candidate-0003-01",
      "claim-candidate-0003-02"
    ],
    "generic": false
  },
  {
    "id": "question-candidate-0004-01",
    "postId": "candidate-0004",
    "topicId": "ai-agents-future-work",
    "text": "How does the Compute-Anchored Wage framework differ from traditional task-based automation models?",
    "type": "connection",
    "targetConceptIds": [
      "concept-465dad65bdb4765b02d1",
      "concept-630ac89d626bf57f63d2"
    ],
    "targetClaimIds": [
      "claim-candidate-0004-01"
    ],
    "generic": false
  },
  {
    "id": "question-candidate-0004-02",
    "postId": "candidate-0004",
    "topicId": "ai-agents-future-work",
    "text": "What are the limitations of assuming a competitive compute market when determining the CAW bound?",
    "type": "reliability",
    "targetConceptIds": [
      "concept-630ac89d626bf57f63d2"
    ],
    "targetClaimIds": [
      "claim-candidate-0004-01"
    ],
    "generic": false
  },
  {
    "id": "question-candidate-0004-03",
    "postId": "candidate-0004",
    "topicId": "ai-agents-future-work",